{
  "schema_version": "contextdb.benchmark-result/v1",
  "run_id": "e3b98e89-6b20-4a9e-a63b-8ffb7b0c2e9f",
  "started_at": "2026-08-12T13:18:42.661Z",
  "finished_at": "2026-08-12T13:18:44.813Z",
  "status": "observation_only",
  "benchmark": {"id": "BENCH-1201", "family": "BENCH-D", "name": "M12 cross-model continuity package observation", "version": "1", "dataset_version": "model-a-to-b-golden-v1", "scenario": "checkpoint, compatibility, migration, re-embedding, handoff and restart", "tier": "deterministic-package-observation"},
  "contextdb": {
    "version_manifest": {
      "schema_version": "contextdb.version-manifest/v1", "product_version": "0.1.0-alpha.1", "release_channel": "development",
      "source": {"git_commit": "0000000000000000000000000000000000000000", "dirty": true, "rfc_revision": "RFC-0001-v0.3", "errata": ["ERRATA-0001"], "adrs": ["ADR-0001", "ADR-0002", "ADR-0003", "ADR-0004", "ADR-0005", "ADR-0006"]},
      "build": {"timestamp": "2026-08-12T13:17:59.693Z", "rustc": "rustc 1.97.1 (8bab26f4f 2026-07-14)", "cargo": "cargo 1.97.1 (c980f4866 2026-06-30)", "target": "x86_64-pc-windows-msvc", "profile": "test", "reproducible": false, "builder": "local-proof-backfill"},
      "formats": {"logical_record": {"writer": 1, "read_min": 1, "read_max": 1, "required_features": []}}, "feature_profile": "research", "features": ["local-package-conformance"]
    },
    "version_manifest_sha256": "12ee5d90a01050a6f12ae9b13e0a5074efad48b10c485491cea30076ee0a25fd"
  },
  "environment": {"os": "Microsoft Windows NT", "os_version": "10.0.26200.0", "architecture": "x86_64", "cpu": "Intel(R) Core(TM) Ultra 9 275HX", "logical_cores": 24, "memory_bytes": 68044750848, "storage": "local NVMe SSD", "filesystem": "NTFS", "rustc": "rustc 1.97.1 (8bab26f4f 2026-07-14)", "cargo": "cargo 1.97.1 (c980f4866 2026-06-30)", "storage_backend": "continuity-fixture", "storage_backend_version": "0.1.0-alpha.1", "build_profile": "test"},
  "configuration": {"seed": 0, "features": ["local-package-conformance"], "budgets": {}, "parameters": {"command": "cargo +1.97.1 test -p contextdb-continuity --no-fail-fast --quiet", "exit_code": 0, "claim_scope": "deterministic package tests; no external model runtime"}, "index_watermarks": {}},
  "metrics": [
    {"name": "continuity.tests_passed", "unit": "tests", "direction": "informational", "observed": 25},
    {"name": "continuity.golden_migrations_passed", "unit": "migrations", "direction": "informational", "observed": 1},
    {"name": "continuity.command_elapsed", "unit": "milliseconds", "direction": "informational", "observed": 2151.437}
  ],
  "artifacts": [{"kind": "golden-fixture", "uri": "crates/contextdb-continuity/tests/fixtures/model_a_to_b_golden.json", "sha256": "1a3f09cac2b0d6abfd515fd6a529930441d7e0649dca62f176dc760a724af022"}],
  "limitations": [
    "The suite contains a BENCH-D threshold evaluator, but this receipt does not invent a frozen public run or copy hidden test values into a benchmark claim.",
    "Both runtime profiles are deterministic in-process fixtures; no hosted or local model process was invoked.",
    "Human wording/identity interpretation is outside this package observation."
  ]
}
