{
  "schema_version": "contextdb.benchmark-result/v1",
  "run_id": "67e34a6a-6860-4f5f-99a4-95a53f3fc813",
  "started_at": "2026-08-22T08:39:10.392Z",
  "finished_at": "2026-08-22T08:39:13.939Z",
  "status": "observation_only",
  "benchmark": {"id": "BENCH-1001", "family": "BENCH-B", "name": "M10 write-pipeline package observation", "version": "1", "dataset_version": "cognition-reference-tests-v1", "scenario": "extraction, evidence alignment, adjudication, promotion, reflection and no-op", "tier": "package-evaluator-observation"},
  "contextdb": {
    "version_manifest": {
      "schema_version": "contextdb.version-manifest/v1", "product_version": "0.1.0-alpha.1", "release_channel": "development",
      "source": {"git_commit": "99d6a6d6a15835ca8c06c0602c9b13982529e3e7", "dirty": true, "rfc_revision": "RFC-0001-v0.3", "errata": ["ERRATA-0001"], "adrs": ["ADR-0001", "ADR-0002", "ADR-0003", "ADR-0004", "ADR-0005", "ADR-0006"]},
      "build": {"timestamp": "2026-08-22T08:39:10.392Z", "rustc": "rustc 1.97.1 (8bab26f4f 2026-07-14)", "cargo": "cargo 1.97.1 (c980f4866 2026-06-30)", "target": "x86_64-pc-windows-msvc", "profile": "test", "reproducible": false, "builder": "local-proof-refresh"},
      "formats": {"logical_record": {"writer": 1, "read_min": 1, "read_max": 1, "required_features": []}}, "feature_profile": "research", "features": ["local-package-conformance"]
    },
    "version_manifest_sha256": "9a05433b303fef9246f49ca06f184eefe54b878cf232c1c8cf54737b3b90081e"
  },
  "environment": {"os": "Microsoft Windows NT", "os_version": "10.0.26200.0", "architecture": "x86_64", "cpu": "Intel(R) Core(TM) Ultra 9 275HX", "logical_cores": 24, "memory_bytes": 68044750848, "storage": "local NVMe SSD", "filesystem": "NTFS", "rustc": "rustc 1.97.1 (8bab26f4f 2026-07-14)", "cargo": "cargo 1.97.1 (c980f4866 2026-06-30)", "storage_backend": "deterministic-cognition-fixture", "storage_backend_version": "0.1.0-alpha.1", "build_profile": "test"},
  "configuration": {"seed": 0, "features": ["local-package-conformance"], "budgets": {}, "parameters": {"command": "cargo +1.97.1 test -p contextdb-cognition --no-fail-fast --quiet", "exit_code": 0, "claim_scope": "package tests; no frozen labelled corpus"}, "index_watermarks": {}},
  "model": {"provider": "recorded", "model": "deterministic-proposal-fixture", "revision": "v1", "prompt_versions": {}, "schema_versions": {"proposal": "v1"}, "embedding_spaces": []},
  "metrics": [
    {"name": "write_pipeline.tests_passed", "unit": "tests", "direction": "informational", "observed": 26},
    {"name": "write_pipeline.command_elapsed", "unit": "milliseconds", "direction": "informational", "observed": 3546.499}
  ],
  "artifacts": [{"kind": "test-source", "uri": "crates/contextdb-cognition/src/tests.rs", "sha256": "a4254b4b70416011e7bb240e46466d5553e06c72da6dffe4445c95041ee39798"}],
  "limitations": [
    "No frozen labelled candidate-quality corpus was emitted, so precision/recall and false-promotion ceilings are not reported.",
    "Passing unit/evaluator tests do not replace the roadmap benchmark.",
    "Elapsed time is Cargo suite time, not per-turn pipeline latency."
  ]
}
